{
    "name":"Todo App",
    "version": "1",
    "auth": "jwt",
    
    "database":{
        "type":"sqlite",
        "name":"database.sqlite",
        "username":"",
        "password":"",
        "host":"",
        "port":""        
    },
    "schema":
        [
            {   
                "name":"Tarea",
                "perm":"700",
                "attrs":[
                    {
                        "name":"descripcion",
                        "type":"str",
                        "req":true,
                        "default":""
                    },
                    {
                        "name":"realizada",
                        "type":"bool",
                        "req":false,
                        "default":false
                    },
                    {
                        "name":"owner",
                        "type":"User",
                        "req":true,
                        "default":""
                    }
                ]
            }
        ]
}
